{
  "id": "frlg_qol_fast_healing",
  "title": "Faster Center Healing",
  "author": "CapnJames95",
  "version": "0.2.0",
  "categories": [
    "QOL",
    "TOOL"
  ],
  "repo": "https://github.com/CapnJames95/gen1recomp-mod-releases",
  "summary": "Shorten the Pokémon Center healing presentation.",
  "tags": [
    "firered",
    "leafgreen"
  ],
  "downloadURL": "https://github.com/CapnJames95/gen1recomp-mod-releases/releases/download/v1.0.0/frlg_qol_fast_healing-0.2.0.zip",
  "permissions": [
    "engine_internals"
  ],
  "api": 2,
  "profile": "overhaul",
  "experimental": true,
  "automatic_version_check": false
}
