{
  "id": "overworldmons",
  "title": "Untamed Tohjo",
  "author": "goldenroddeptstore",
  "version": "1.2.0",
  "categories": [
    "GAMEPLAY"
  ],
  "repo": "https://github.com/goldenroddeptstore/untamed-tohjo",
  "summary": "Replaces random encounters with visible roaming Pokémon, chaining, and an optional follower system.",
  "tags": [
    "overworld encounters",
    "followers",
    "shinies",
    "gen 1",
    "gen 2"
  ],
  "github": "goldenroddeptstore/untamed-tohjo",
  "game_version": ">=0.0.0-dev <1.0.0",
  "games": [
    "gen1",
    "gen2"
  ],
  "permissions": [
    "engine_internals"
  ],
  "api": 2,
  "profile": "content"
}
