
{
  "id": "wilds_of_kanto_gen3",
  "title": "Wilds of Kanto Revival",
  "author": "poooooby",
  "version": "2.8.1",
  "summary": "Adds visible overworld Pokémon, followers, shiny encounters, town Pokémon, and expanded sprite styles through Gen 9.",
  "categories": [
    "CONTENT",
    "GAMEPLAY",
    "ART"
  ],
  "repo": "https://github.com/poooooby/wilds-of-kanto-gen-3",
  "github": "poooooby/wilds-of-kanto-gen-3",
  "automatic_version_check": true,
  "api": 2,
  "game_version": ">=0.0.0-0 <2.0.0",
  "profile": "content",
  "affects_link": false,
  "games": [
    "gen1",
    "gen2"
  ],
  "permissions": [
    "engine_internals"
  ],
  "dependencies": [],
  "conflicts": [
    "overworld_wild_spawns",
    "SHINY_POKEMON"
  ]
}
