{
  "id": "legalmon",
  "title": "LegalMon",
  "author": "CapnJames95",
  "version": "0.17.1",
  "categories": [
    "TOOL"
  ],
  "repo": "https://github.com/CapnJames95/gen1recomp-mod-releases",
  "summary": "Configure Pokémon, validate supported acquisition constraints and deliver them to party or PC.",
  "tags": [
    "firered",
    "leafgreen"
  ],
  "downloadURL": "https://github.com/CapnJames95/gen1recomp-mod-releases/releases/download/v1.0.0/legalmon-0.17.1.zip",
  "game_version": ">=0.0.0-0 <2.0.0",
  "permissions": [
    "engine_internals"
  ],
  "api": 2,
  "profile": "overhaul",
  "experimental": true,
  "automatic_version_check": false
}
