{
  "id": "quick-heal-party",
  "title": "Quick Heal Party",
  "author": "CapnJames95",
  "version": "0.1.0",
  "categories": [
    "QOL",
    "TOOL"
  ],
  "repo": "https://github.com/CapnJames95/gen1recomp-mod-releases",
  "summary": "Heal one Pokémon or the whole party with owned medicine after reviewing the cost.",
  "tags": [
    "firered",
    "leafgreen"
  ],
  "downloadURL": "https://github.com/CapnJames95/gen1recomp-mod-releases/releases/download/v1.0.0/quick-heal-party-0.1.0.zip",
  "game_version": ">=0.3.21 <0.4.0",
  "permissions": [
    "engine_internals"
  ],
  "api": 2,
  "profile": "overhaul",
  "experimental": true,
  "automatic_version_check": false
}
