{
  "id": "shiny_hunter",
  "title": "Shiny Hunter",
  "author": "CapnJames95",
  "version": "0.1.5",
  "categories": [
    "TOOL"
  ],
  "repo": "https://github.com/CapnJames95/gen1recomp-mod-releases",
  "summary": "Automate encounter attempts and stop for shinies or other selected targets.",
  "tags": [
    "firered",
    "leafgreen"
  ],
  "downloadURL": "https://github.com/CapnJames95/gen1recomp-mod-releases/releases/download/v1.0.0/shiny-hunter-0.1.5.zip",
  "game_version": ">=0.3.21 <2.0.0",
  "permissions": [
    "engine_internals"
  ],
  "api": 2,
  "profile": "overhaul",
  "experimental": true,
  "automatic_version_check": false
}
