{
  "id": "encounter_reset",
  "title": "Encounter Reset",
  "author": "CapnJames95",
  "version": "0.2.0",
  "categories": [
    "TOOL"
  ],
  "repo": "https://github.com/CapnJames95/gen1recomp-mod-releases",
  "summary": "Reset individual encounters, gifts, fossils, NPC trades or your roaming beast.",
  "tags": [
    "firered",
    "leafgreen"
  ],
  "downloadURL": "https://github.com/CapnJames95/gen1recomp-mod-releases/releases/download/v1.0.0/encounter-reset-0.2.0.zip",
  "game_version": ">=0.3.21 <2.0.0",
  "permissions": [
    "engine_internals"
  ],
  "api": 2,
  "profile": "overhaul",
  "experimental": true,
  "automatic_version_check": false
}
